claim_id,support_status,evidence,recommended_wording,remaining_gap
test_access_recipe_model,supported,"12 pressure cases, avg candidate recipes=147.5","Test Access Recipe can express serial, FPP, BIST, hybrid and interconnect access choices as schedulable alternatives.","Still a research model, not automatic DFT extraction from industrial design databases."
path_schedule_joint_optimization,supported,"cases=12, avg_gain=27.06%, min_gain=10.00%, max_gain=46.67%","Under shared-resource pressure, every task is still TAP-enabled first; joint selection mixes BIST local execution and FPP data-transfer paths under explicit test-session constraints.",Do not claim this gain on ordinary M10 sweep; it is a pressure-suite result.
unified_2_5d_3d_5_5d_model,supported,"topologies=3, avg_gain_spread=18.64%, group_counts=[2.0, 1.0, 2.75]","The unified model can encode topology-dependent resource bottlenecks, not just rename the same workload.",Topology pressure parameters remain modeling assumptions and must be stated as such.
thermal_aware_validation,partial,"avg_temperature_spread_by_topology=[4.419, 11.567, 11.694] C",Thermal proxy now produces visible stress differentiation and can be used for risk analysis; HotSpot remains offline validation.,Still not a closed HotSpot-in-the-loop optimizer.
cpsat_alns_hybrid,partial,"m5_rows=6, m5_not_worse_than_m4=6; ALNS not promoted in M21",CP-SAT is a useful exact/feasible refinement backend on small and medium pressure cases; ALNS remains an extension prototype.,ALNS still needs a stronger implementation before becoming a core contribution.
